⚠ Using built-in MIRAGE prompts
================================================================================
MedQA Evaluation (MAX ASYNC)
================================================================================
Model: gpt-4o-mini
Modes: ['planning_v5']
Max questions: 2000
Max concurrent requests: 100
RAG: direct=25 docs, baseline/planning=5x5 docs
Retriever: MedCPT | Corpus: Textbooks
================================================================================
✓ Loaded 1273 MedQA questions

Processing 1273 questions with 100 concurrent requests...
Started at: 2026-01-23 15:32:23
Estimated API calls: ~0
================================================================================
Evaluating:   0%|          | 0/1273 [00:00<?, ?it/s]No sentence-transformers model found with name ncbi/MedCPT-Query-Encoder. Creating a new one with CLS pooling.
Initializing the document extracter...
Initialization finished!
✓ MIRAGE retriever initialized: MedCPT on Textbooks
Evaluating:   0%|          | 1/1273 [02:55<62:05:55, 175.75s/it]Evaluating:   0%|          | 5/1273 [02:55<9:13:38, 26.20s/it]  Evaluating:   1%|          | 9/1273 [03:00<4:22:26, 12.46s/it]Evaluating:   6%|▌         | 72/1273 [03:00<18:43,  1.07it/s] Evaluating:   7%|▋         | 93/1273 [03:02<13:16,  1.48it/s]Evaluating:   8%|▊         | 106/1273 [03:03<10:39,  1.83it/s]Evaluating:   9%|▉         | 115/1273 [03:03<08:48,  2.19it/s]Evaluating:  10%|▉         | 123/1273 [03:03<07:15,  2.64it/s]Evaluating:  10%|█         | 130/1273 [03:03<05:59,  3.18it/s]Evaluating:  11%|█         | 140/1273 [03:04<04:22,  4.32it/s]Evaluating:  12%|█▏        | 147/1273 [03:04<03:30,  5.35it/s]Evaluating:  12%|█▏        | 153/1273 [03:04<02:56,  6.36it/s]Evaluating:  12%|█▏        | 158/1273 [03:04<02:27,  7.58it/s]Evaluating:  13%|█▎        | 163/1273 [03:04<01:59,  9.28it/s]Evaluating:  13%|█▎        | 168/1273 [03:05<01:48, 10.20it/s]Evaluating:  14%|█▎        | 172/1273 [03:05<01:35, 11.58it/s]Evaluating:  14%|█▍        | 176/1273 [03:05<01:36, 11.40it/s]Evaluating:  14%|█▍        | 179/1273 [03:05<01:26, 12.58it/s]Evaluating:  14%|█▍        | 182/1273 [03:06<01:31, 11.87it/s]Evaluating:  15%|█▍        | 186/1273 [03:06<01:25, 12.74it/s]Evaluating:  15%|█▍        | 189/1273 [03:06<01:16, 14.24it/s]Evaluating:  15%|█▌        | 196/1273 [03:06<00:50, 21.32it/s]Evaluating:  16%|█▌        | 200/1273 [03:06<00:46, 22.87it/s]Evaluating:  16%|█▌        | 205/1273 [03:06<00:39, 26.71it/s]Evaluating:  16%|█▋        | 209/1273 [03:07<00:37, 28.33it/s]Evaluating:  17%|█▋        | 213/1273 [03:07<00:38, 27.78it/s]Evaluating:  17%|█▋        | 220/1273 [03:07<00:31, 33.66it/s]Evaluating:  18%|█▊        | 225/1273 [03:07<00:28, 36.53it/s]Evaluating:  18%|█▊        | 230/1273 [03:07<00:31, 32.83it/s]Evaluating:  18%|█▊        | 234/1273 [03:07<00:34, 30.14it/s]Evaluating:  19%|█▊        | 238/1273 [03:07<00:37, 27.55it/s]Evaluating:  19%|█▉        | 241/1273 [03:08<00:40, 25.23it/s]Evaluating:  19%|█▉        | 245/1273 [03:08<00:40, 25.55it/s]Evaluating:  19%|█▉        | 248/1273 [03:08<00:39, 25.67it/s]Evaluating:  20%|█▉        | 251/1273 [03:08<00:45, 22.38it/s]Evaluating:  20%|█▉        | 254/1273 [03:08<00:46, 21.85it/s]Evaluating:  20%|██        | 257/1273 [03:08<00:57, 17.75it/s]Evaluating:  20%|██        | 260/1273 [03:09<00:58, 17.36it/s]Evaluating:  21%|██        | 263/1273 [03:09<00:57, 17.47it/s]Evaluating:  21%|██        | 268/1273 [03:09<00:42, 23.45it/s]Evaluating:  21%|██▏       | 273/1273 [03:09<00:35, 27.92it/s]Evaluating:  22%|██▏       | 277/1273 [03:09<00:34, 28.92it/s]Evaluating:  22%|██▏       | 281/1273 [03:09<00:43, 22.94it/s]Evaluating:  22%|██▏       | 284/1273 [03:10<00:44, 22.28it/s]Evaluating:  23%|██▎       | 287/1273 [03:10<00:48, 20.35it/s]Evaluating:  23%|██▎       | 290/1273 [03:10<00:44, 22.23it/s]Evaluating:  23%|██▎       | 293/1273 [03:10<00:44, 21.89it/s]Evaluating:  23%|██▎       | 298/1273 [03:10<00:46, 20.94it/s]Evaluating:  24%|██▎       | 301/1273 [03:10<00:46, 20.71it/s]Evaluating:  24%|██▍       | 307/1273 [03:11<00:39, 24.39it/s]Evaluating:  24%|██▍       | 310/1273 [03:11<00:38, 25.18it/s]Evaluating:  25%|██▍       | 315/1273 [03:11<00:32, 29.07it/s]Evaluating:  25%|██▌       | 321/1273 [03:11<00:28, 32.95it/s]Evaluating:  26%|██▌       | 325/1273 [03:11<00:29, 31.73it/s]Evaluating:  26%|██▌       | 330/1273 [03:11<00:26, 35.50it/s]Evaluating:  26%|██▌       | 334/1273 [03:11<00:28, 32.87it/s]Evaluating:  27%|██▋       | 338/1273 [03:12<00:31, 29.34it/s]Evaluating:  27%|██▋       | 342/1273 [03:12<00:47, 19.47it/s]Evaluating:  27%|██▋       | 346/1273 [03:12<00:41, 22.34it/s]Evaluating:  28%|██▊       | 354/1273 [03:12<00:30, 30.38it/s]Evaluating:  28%|██▊       | 359/1273 [03:13<00:40, 22.70it/s]Evaluating:  28%|██▊       | 362/1273 [03:13<00:43, 21.02it/s]Evaluating:  29%|██▊       | 365/1273 [03:13<00:42, 21.38it/s]Evaluating:  29%|██▉       | 372/1273 [03:13<00:39, 22.87it/s]Evaluating:  30%|██▉       | 378/1273 [03:13<00:33, 26.50it/s]Evaluating:  30%|██▉       | 381/1273 [03:13<00:35, 25.37it/s]Evaluating:  30%|███       | 385/1273 [03:14<00:34, 25.50it/s]Evaluating:  31%|███       | 389/1273 [03:14<00:36, 24.07it/s]Evaluating:  31%|███       | 395/1273 [03:14<00:28, 30.62it/s]Evaluating:  31%|███▏      | 400/1273 [03:14<00:30, 28.38it/s]Evaluating:  32%|███▏      | 404/1273 [03:14<00:33, 25.77it/s]Evaluating:  32%|███▏      | 409/1273 [03:14<00:29, 29.19it/s]Evaluating:  32%|███▏      | 413/1273 [03:15<00:28, 30.03it/s]Evaluating:  33%|███▎      | 417/1273 [03:15<00:31, 27.35it/s]Evaluating:  33%|███▎      | 423/1273 [03:15<00:27, 30.46it/s]Evaluating:  34%|███▎      | 427/1273 [03:15<00:40, 20.82it/s]Evaluating:  34%|███▍      | 430/1273 [03:15<00:38, 21.64it/s]Evaluating:  34%|███▍      | 434/1273 [03:16<00:37, 22.62it/s]Evaluating:  34%|███▍      | 437/1273 [03:16<00:37, 22.45it/s]Evaluating:  35%|███▍      | 440/1273 [03:16<00:36, 22.78it/s]Evaluating:  35%|███▍      | 443/1273 [03:16<00:38, 21.58it/s]Evaluating:  35%|███▌      | 446/1273 [03:16<00:41, 20.00it/s]Evaluating:  35%|███▌      | 449/1273 [03:16<00:46, 17.82it/s]Evaluating:  36%|███▌      | 452/1273 [03:16<00:42, 19.36it/s]Evaluating:  36%|███▌      | 456/1273 [03:17<00:35, 22.75it/s]Evaluating:  36%|███▌      | 459/1273 [03:17<00:33, 23.96it/s]Evaluating:  37%|███▋      | 466/1273 [03:17<00:26, 30.45it/s]Evaluating:  37%|███▋      | 470/1273 [03:17<00:27, 29.66it/s]Evaluating:  37%|███▋      | 475/1273 [03:17<00:25, 31.20it/s]Evaluating:  38%|███▊      | 479/1273 [03:17<00:29, 26.47it/s]Evaluating:  38%|███▊      | 485/1273 [03:17<00:24, 32.32it/s]Evaluating:  38%|███▊      | 490/1273 [03:18<00:22, 34.43it/s]Evaluating:  39%|███▉      | 494/1273 [03:18<00:25, 30.22it/s]Evaluating:  39%|███▉      | 498/1273 [03:18<00:28, 27.26it/s]Evaluating:  39%|███▉      | 502/1273 [03:18<00:25, 29.79it/s]Evaluating:  40%|███▉      | 506/1273 [03:18<00:38, 19.86it/s]Evaluating:  40%|███▉      | 509/1273 [03:19<00:36, 20.83it/s]Evaluating:  40%|████      | 512/1273 [03:19<00:33, 22.53it/s]Evaluating:  40%|████      | 515/1273 [03:19<00:40, 18.58it/s]Evaluating:  41%|████      | 523/1273 [03:19<00:24, 30.11it/s]Evaluating:  42%|████▏     | 529/1273 [03:19<00:21, 34.90it/s]Evaluating:  42%|████▏     | 534/1273 [03:19<00:25, 29.25it/s]Evaluating:  42%|████▏     | 538/1273 [03:20<00:29, 25.32it/s]Evaluating:  43%|████▎     | 542/1273 [03:20<00:41, 17.66it/s]Evaluating:  43%|████▎     | 546/1273 [03:20<00:35, 20.66it/s]Evaluating:  43%|████▎     | 549/1273 [03:20<00:34, 20.93it/s]Evaluating:  44%|████▎     | 554/1273 [03:20<00:27, 26.12it/s]Evaluating:  44%|████▍     | 558/1273 [03:21<00:30, 23.42it/s]Evaluating:  44%|████▍     | 561/1273 [03:21<00:29, 24.14it/s]Evaluating:  44%|████▍     | 564/1273 [03:21<00:32, 21.56it/s]Evaluating:  45%|████▍     | 570/1273 [03:21<00:24, 28.71it/s]Evaluating:  45%|████▌     | 576/1273 [03:21<00:19, 35.05it/s]Evaluating:  46%|████▌     | 580/1273 [03:21<00:19, 35.43it/s]Evaluating:  46%|████▌     | 584/1273 [03:21<00:20, 33.40it/s]Evaluating:  46%|████▋     | 590/1273 [03:21<00:17, 38.03it/s]Evaluating:  47%|████▋     | 595/1273 [03:22<00:21, 31.74it/s]Evaluating:  47%|████▋     | 599/1273 [03:22<00:23, 29.00it/s]Evaluating:  47%|████▋     | 603/1273 [03:22<00:28, 23.14it/s]Evaluating:  48%|████▊     | 606/1273 [03:22<00:27, 23.98it/s]Evaluating:  48%|████▊     | 609/1273 [03:22<00:28, 23.60it/s]Evaluating:  48%|████▊     | 612/1273 [03:22<00:29, 22.20it/s]Evaluating:  48%|████▊     | 615/1273 [03:23<00:39, 16.69it/s]Evaluating:  49%|████▊     | 618/1273 [03:23<00:36, 17.83it/s]Evaluating:  49%|████▉     | 623/1273 [03:23<00:29, 22.02it/s]Evaluating:  49%|████▉     | 627/1273 [03:23<00:28, 22.74it/s]Evaluating:  50%|████▉     | 632/1273 [03:23<00:25, 25.59it/s]Evaluating:  50%|█████     | 639/1273 [03:24<00:20, 31.26it/s]Evaluating:  51%|█████     | 644/1273 [03:24<00:18, 34.67it/s]Evaluating:  51%|█████     | 648/1273 [03:24<00:21, 29.12it/s]Evaluating:  51%|█████     | 652/1273 [03:24<00:21, 29.44it/s]Evaluating:  52%|█████▏    | 656/1273 [03:24<00:23, 26.46it/s]Evaluating:  52%|█████▏    | 659/1273 [03:24<00:25, 23.97it/s]Evaluating:  52%|█████▏    | 662/1273 [03:24<00:26, 23.18it/s]Evaluating:  52%|█████▏    | 666/1273 [03:25<00:24, 24.96it/s]Evaluating:  53%|█████▎    | 670/1273 [03:25<00:23, 25.31it/s]Evaluating:  53%|█████▎    | 674/1273 [03:25<00:21, 27.98it/s]Evaluating:  53%|█████▎    | 679/1273 [03:25<00:18, 32.58it/s]Evaluating:  54%|█████▍    | 686/1273 [03:25<00:15, 38.13it/s]Evaluating:  54%|█████▍    | 690/1273 [03:25<00:17, 34.04it/s]Evaluating:  55%|█████▍    | 694/1273 [03:26<00:25, 22.99it/s]Evaluating:  55%|█████▍    | 698/1273 [03:26<00:22, 25.89it/s]Evaluating:  55%|█████▌    | 702/1273 [03:26<00:21, 26.38it/s]Evaluating:  55%|█████▌    | 706/1273 [03:26<00:23, 23.72it/s]Evaluating:  56%|█████▌    | 709/1273 [03:26<00:23, 23.55it/s]Evaluating:  56%|█████▌    | 712/1273 [03:26<00:23, 23.38it/s]Evaluating:  56%|█████▌    | 715/1273 [03:27<00:31, 17.60it/s]Evaluating:  56%|█████▋    | 718/1273 [03:27<00:35, 15.60it/s]Evaluating:  57%|█████▋    | 721/1273 [03:27<00:32, 17.14it/s]Evaluating:  57%|█████▋    | 725/1273 [03:27<00:26, 20.42it/s]Evaluating:  57%|█████▋    | 728/1273 [03:27<00:24, 22.16it/s]Evaluating:  58%|█████▊    | 735/1273 [03:27<00:16, 32.79it/s]Evaluating:  58%|█████▊    | 742/1273 [03:27<00:13, 38.59it/s]Evaluating:  59%|█████▊    | 747/1273 [03:28<00:14, 36.92it/s]Evaluating:  59%|█████▉    | 751/1273 [03:28<00:18, 28.79it/s]Evaluating:  59%|█████▉    | 757/1273 [03:28<00:14, 34.92it/s]Evaluating:  60%|█████▉    | 762/1273 [03:28<00:15, 32.79it/s]Evaluating:  60%|██████    | 766/1273 [03:28<00:20, 25.24it/s]Evaluating:  60%|██████    | 770/1273 [03:29<00:22, 22.29it/s]Evaluating:  61%|██████    | 773/1273 [03:29<00:24, 20.09it/s]Evaluating:  61%|██████    | 778/1273 [03:29<00:22, 22.05it/s]Evaluating:  61%|██████▏   | 782/1273 [03:29<00:19, 25.21it/s]Evaluating:  62%|██████▏   | 785/1273 [03:29<00:20, 23.83it/s]Evaluating:  62%|██████▏   | 789/1273 [03:29<00:20, 24.14it/s]Evaluating:  62%|██████▏   | 792/1273 [03:30<00:22, 21.16it/s]Evaluating:  62%|██████▏   | 795/1273 [03:30<00:23, 20.27it/s]Evaluating:  63%|██████▎   | 798/1273 [03:30<00:24, 19.45it/s]Evaluating:  63%|██████▎   | 801/1273 [03:30<00:22, 20.98it/s]Evaluating:  63%|██████▎   | 805/1273 [03:30<00:18, 24.85it/s]Evaluating:  64%|██████▎   | 809/1273 [03:30<00:17, 26.13it/s]Evaluating:  64%|██████▍   | 812/1273 [03:30<00:18, 25.16it/s]Evaluating:  64%|██████▍   | 816/1273 [03:31<00:16, 28.48it/s]Evaluating:  64%|██████▍   | 821/1273 [03:31<00:14, 32.09it/s]Evaluating:  65%|██████▍   | 825/1273 [03:31<00:13, 33.81it/s]Evaluating:  65%|██████▌   | 831/1273 [03:31<00:10, 40.43it/s]Evaluating:  66%|██████▌   | 837/1273 [03:31<00:09, 45.48it/s]Evaluating:  66%|██████▌   | 842/1273 [03:31<00:16, 26.28it/s]Evaluating:  66%|██████▋   | 846/1273 [03:32<00:17, 24.45it/s]Evaluating:  67%|██████▋   | 850/1273 [03:32<00:19, 21.42it/s]Evaluating:  67%|██████▋   | 854/1273 [03:32<00:17, 23.31it/s]Evaluating:  67%|██████▋   | 859/1273 [03:32<00:15, 27.05it/s]Evaluating:  68%|██████▊   | 863/1273 [03:32<00:15, 25.77it/s]Evaluating:  68%|██████▊   | 866/1273 [03:32<00:15, 25.84it/s]Evaluating:  68%|██████▊   | 870/1273 [03:33<00:17, 23.38it/s]Evaluating:  69%|██████▊   | 873/1273 [03:33<00:18, 22.13it/s]Evaluating:  69%|██████▉   | 876/1273 [03:33<00:19, 19.90it/s]Evaluating:  69%|██████▉   | 882/1273 [03:33<00:15, 24.44it/s]Evaluating:  70%|██████▉   | 885/1273 [03:33<00:15, 25.22it/s]Evaluating:  70%|██████▉   | 888/1273 [03:33<00:15, 25.17it/s]Evaluating:  70%|██████▉   | 891/1273 [03:33<00:15, 24.35it/s]Evaluating:  70%|███████   | 894/1273 [03:34<00:17, 21.97it/s]Evaluating:  71%|███████   | 900/1273 [03:34<00:12, 30.06it/s]Evaluating:  71%|███████   | 904/1273 [03:34<00:12, 29.95it/s]Evaluating:  71%|███████▏  | 910/1273 [03:34<00:12, 29.46it/s]Evaluating:  72%|███████▏  | 915/1273 [03:34<00:12, 28.80it/s]Evaluating:  72%|███████▏  | 920/1273 [03:34<00:11, 31.60it/s]Evaluating:  73%|███████▎  | 924/1273 [03:35<00:11, 30.03it/s]Evaluating:  73%|███████▎  | 928/1273 [03:35<00:13, 26.43it/s]Evaluating:  73%|███████▎  | 931/1273 [03:35<00:16, 20.88it/s]Evaluating:  73%|███████▎  | 935/1273 [03:35<00:15, 22.06it/s]Evaluating:  74%|███████▍  | 939/1273 [03:35<00:13, 24.84it/s]Evaluating:  74%|███████▍  | 942/1273 [03:35<00:13, 24.02it/s]Evaluating:  74%|███████▍  | 948/1273 [03:35<00:10, 31.43it/s]Evaluating:  75%|███████▍  | 952/1273 [03:36<00:09, 32.46it/s]Evaluating:  75%|███████▌  | 956/1273 [03:36<00:09, 32.04it/s]Evaluating:  75%|███████▌  | 960/1273 [03:36<00:12, 25.18it/s]Evaluating:  76%|███████▌  | 964/1273 [03:36<00:12, 24.78it/s]Evaluating:  76%|███████▌  | 968/1273 [03:36<00:11, 26.31it/s]Evaluating:  76%|███████▋  | 971/1273 [03:36<00:11, 26.79it/s]Evaluating:  77%|███████▋  | 979/1273 [03:37<00:08, 34.29it/s]Evaluating:  77%|███████▋  | 983/1273 [03:37<00:09, 30.84it/s]Evaluating:  78%|███████▊  | 988/1273 [03:37<00:09, 31.62it/s]Evaluating:  78%|███████▊  | 992/1273 [03:37<00:11, 23.54it/s]Evaluating:  78%|███████▊  | 995/1273 [03:37<00:11, 24.56it/s]Evaluating:  78%|███████▊  | 998/1273 [03:37<00:12, 22.26it/s]Evaluating:  79%|███████▊  | 1001/1273 [03:38<00:14, 18.52it/s]Evaluating:  79%|███████▉  | 1004/1273 [03:38<00:14, 18.08it/s]Evaluating:  79%|███████▉  | 1009/1273 [03:38<00:12, 21.59it/s]Evaluating:  80%|███████▉  | 1016/1273 [03:38<00:08, 28.95it/s]Evaluating:  80%|████████  | 1020/1273 [03:38<00:09, 27.24it/s]Evaluating:  80%|████████  | 1023/1273 [03:38<00:09, 27.70it/s]Evaluating:  81%|████████  | 1026/1273 [03:38<00:08, 27.84it/s]Evaluating:  81%|████████  | 1029/1273 [03:39<00:09, 24.80it/s]Evaluating:  81%|████████  | 1032/1273 [03:39<00:10, 21.97it/s]Evaluating:  81%|████████▏ | 1035/1273 [03:39<00:11, 21.52it/s]Evaluating:  82%|████████▏ | 1038/1273 [03:39<00:11, 20.35it/s]Evaluating:  82%|████████▏ | 1041/1273 [03:39<00:11, 19.96it/s]Evaluating:  82%|████████▏ | 1045/1273 [03:39<00:09, 23.14it/s]Evaluating:  82%|████████▏ | 1048/1273 [03:40<00:11, 20.43it/s]Evaluating:  83%|████████▎ | 1053/1273 [03:40<00:09, 23.92it/s]Evaluating:  83%|████████▎ | 1056/1273 [03:40<00:09, 23.67it/s]Evaluating:  83%|████████▎ | 1060/1273 [03:40<00:08, 26.37it/s]Evaluating:  84%|████████▎ | 1063/1273 [03:40<00:08, 25.21it/s]Evaluating:  84%|████████▎ | 1066/1273 [03:40<00:07, 25.90it/s]Evaluating:  84%|████████▍ | 1070/1273 [03:40<00:07, 27.82it/s]Evaluating:  84%|████████▍ | 1075/1273 [03:41<00:08, 22.13it/s]Evaluating:  85%|████████▍ | 1079/1273 [03:41<00:08, 23.64it/s]Evaluating:  85%|████████▌ | 1083/1273 [03:41<00:08, 23.54it/s]Evaluating:  85%|████████▌ | 1086/1273 [03:41<00:09, 20.42it/s]Evaluating:  86%|████████▌ | 1089/1273 [03:41<00:08, 21.97it/s]Evaluating:  86%|████████▌ | 1092/1273 [03:41<00:08, 21.21it/s]Evaluating:  86%|████████▌ | 1095/1273 [03:42<00:08, 20.85it/s]Evaluating:  86%|████████▋ | 1101/1273 [03:42<00:05, 28.94it/s]Evaluating:  87%|████████▋ | 1105/1273 [03:42<00:05, 28.39it/s]Evaluating:  87%|████████▋ | 1109/1273 [03:42<00:07, 22.91it/s]Evaluating:  87%|████████▋ | 1112/1273 [03:42<00:08, 18.25it/s]Evaluating:  88%|████████▊ | 1117/1273 [03:43<00:06, 22.52it/s]Evaluating:  88%|████████▊ | 1125/1273 [03:43<00:04, 33.22it/s]Evaluating:  89%|████████▉ | 1130/1273 [03:43<00:04, 33.97it/s]Evaluating:  89%|████████▉ | 1134/1273 [03:43<00:04, 30.02it/s]Evaluating:  89%|████████▉ | 1138/1273 [03:43<00:05, 25.76it/s]Evaluating:  90%|████████▉ | 1141/1273 [03:43<00:06, 19.02it/s]Evaluating:  90%|████████▉ | 1145/1273 [03:44<00:05, 22.34it/s]Evaluating:  90%|█████████ | 1149/1273 [03:44<00:05, 23.54it/s]Evaluating:  91%|█████████ | 1154/1273 [03:44<00:04, 25.44it/s]Evaluating:  91%|█████████ | 1160/1273 [03:44<00:03, 30.33it/s]Evaluating:  92%|█████████▏| 1168/1273 [03:44<00:02, 37.78it/s]Evaluating:  92%|█████████▏| 1173/1273 [03:45<00:04, 23.71it/s]Evaluating:  92%|█████████▏| 1177/1273 [03:45<00:03, 24.63it/s]Evaluating:  93%|█████████▎| 1181/1273 [03:45<00:03, 24.11it/s]Evaluating:  93%|█████████▎| 1184/1273 [03:45<00:03, 22.76it/s]Evaluating:  93%|█████████▎| 1189/1273 [03:45<00:03, 27.49it/s]Evaluating:  94%|█████████▎| 1193/1273 [03:45<00:03, 26.65it/s]Evaluating:  94%|█████████▍| 1196/1273 [03:45<00:02, 26.57it/s]Evaluating:  94%|█████████▍| 1199/1273 [03:46<00:02, 24.67it/s]Evaluating:  94%|█████████▍| 1202/1273 [03:46<00:03, 20.67it/s]Evaluating:  95%|█████████▍| 1205/1273 [03:46<00:03, 20.78it/s]Evaluating:  95%|█████████▍| 1208/1273 [03:46<00:03, 21.36it/s]Evaluating:  95%|█████████▌| 1211/1273 [03:46<00:02, 22.69it/s]Evaluating:  95%|█████████▌| 1215/1273 [03:46<00:02, 24.86it/s]Evaluating:  96%|█████████▌| 1219/1273 [03:46<00:02, 25.83it/s]Evaluating:  96%|█████████▌| 1224/1273 [03:47<00:01, 29.97it/s]Evaluating:  96%|█████████▋| 1228/1273 [03:47<00:01, 26.80it/s]Evaluating:  97%|█████████▋| 1232/1273 [03:47<00:01, 28.73it/s]Evaluating:  97%|█████████▋| 1238/1273 [03:47<00:01, 32.76it/s]Evaluating:  98%|█████████▊| 1242/1273 [03:47<00:01, 30.32it/s]Evaluating:  98%|█████████▊| 1246/1273 [03:47<00:00, 29.18it/s]Evaluating:  98%|█████████▊| 1249/1273 [03:48<00:00, 24.48it/s]Evaluating:  99%|█████████▊| 1257/1273 [03:48<00:00, 32.68it/s]Evaluating:  99%|█████████▉| 1261/1273 [03:48<00:00, 27.25it/s]Evaluating:  99%|█████████▉| 1264/1273 [03:48<00:00, 20.51it/s]Evaluating: 100%|█████████▉| 1267/1273 [03:49<00:00, 12.01it/s]Evaluating: 100%|█████████▉| 1270/1273 [03:49<00:00, 13.76it/s]Evaluating: 100%|█████████▉| 1272/1273 [03:49<00:00, 14.39it/s]Evaluating: 100%|██████████| 1273/1273 [03:50<00:00,  5.53it/s]

[15:36:13] Progress: 50/1273 (3.9%)
  Elapsed: 3.8 min | Speed: 13.0 q/min | ETA: 93.9 min
  planning_v5 :  36/ 50 (72.0%)
--------------------------------------------------------------------------------

[15:36:13] Progress: 100/1273 (7.9%)
  Elapsed: 3.8 min | Speed: 26.1 q/min | ETA: 45.0 min
  planning_v5 :  80/100 (80.0%)
--------------------------------------------------------------------------------

[15:36:13] Progress: 150/1273 (11.8%)
  Elapsed: 3.8 min | Speed: 39.1 q/min | ETA: 28.7 min
  planning_v5 : 121/150 (80.7%)
--------------------------------------------------------------------------------

[15:36:13] Progress: 200/1273 (15.7%)
  Elapsed: 3.8 min | Speed: 52.1 q/min | ETA: 20.6 min
  planning_v5 : 161/200 (80.5%)
--------------------------------------------------------------------------------

[15:36:13] Progress: 250/1273 (19.6%)
  Elapsed: 3.8 min | Speed: 65.1 q/min | ETA: 15.7 min
  planning_v5 : 196/250 (78.4%)
--------------------------------------------------------------------------------

[15:36:13] Progress: 300/1273 (23.6%)
  Elapsed: 3.8 min | Speed: 78.2 q/min | ETA: 12.4 min
  planning_v5 : 236/300 (78.7%)
--------------------------------------------------------------------------------

[15:36:13] Progress: 350/1273 (27.5%)
  Elapsed: 3.8 min | Speed: 91.2 q/min | ETA: 10.1 min
  planning_v5 : 277/350 (79.1%)
--------------------------------------------------------------------------------

[15:36:13] Progress: 400/1273 (31.4%)
  Elapsed: 3.8 min | Speed: 104.2 q/min | ETA: 8.4 min
  planning_v5 : 319/400 (79.8%)
--------------------------------------------------------------------------------

[15:36:13] Progress: 450/1273 (35.3%)
  Elapsed: 3.8 min | Speed: 117.3 q/min | ETA: 7.0 min
  planning_v5 : 363/450 (80.7%)
--------------------------------------------------------------------------------

[15:36:13] Progress: 500/1273 (39.3%)
  Elapsed: 3.8 min | Speed: 130.3 q/min | ETA: 5.9 min
  planning_v5 : 402/500 (80.4%)
--------------------------------------------------------------------------------

[15:36:13] Progress: 550/1273 (43.2%)
  Elapsed: 3.8 min | Speed: 143.3 q/min | ETA: 5.0 min
  planning_v5 : 444/550 (80.7%)
--------------------------------------------------------------------------------

[15:36:13] Progress: 600/1273 (47.1%)
  Elapsed: 3.8 min | Speed: 156.3 q/min | ETA: 4.3 min
  planning_v5 : 485/600 (80.8%)
--------------------------------------------------------------------------------

[15:36:13] Progress: 650/1273 (51.1%)
  Elapsed: 3.8 min | Speed: 169.4 q/min | ETA: 3.7 min
  planning_v5 : 525/650 (80.8%)
--------------------------------------------------------------------------------

[15:36:13] Progress: 700/1273 (55.0%)
  Elapsed: 3.8 min | Speed: 182.4 q/min | ETA: 3.1 min
  planning_v5 : 561/700 (80.1%)
--------------------------------------------------------------------------------

[15:36:13] Progress: 750/1273 (58.9%)
  Elapsed: 3.8 min | Speed: 195.4 q/min | ETA: 2.7 min
  planning_v5 : 601/750 (80.1%)
--------------------------------------------------------------------------------

[15:36:13] Progress: 800/1273 (62.8%)
  Elapsed: 3.8 min | Speed: 208.5 q/min | ETA: 2.3 min
  planning_v5 : 640/800 (80.0%)
--------------------------------------------------------------------------------

[15:36:13] Progress: 850/1273 (66.8%)
  Elapsed: 3.8 min | Speed: 221.5 q/min | ETA: 1.9 min
  planning_v5 : 686/850 (80.7%)
--------------------------------------------------------------------------------

[15:36:13] Progress: 900/1273 (70.7%)
  Elapsed: 3.8 min | Speed: 234.5 q/min | ETA: 1.6 min
  planning_v5 : 722/900 (80.2%)
--------------------------------------------------------------------------------

[15:36:13] Progress: 950/1273 (74.6%)
  Elapsed: 3.8 min | Speed: 247.5 q/min | ETA: 1.3 min
  planning_v5 : 757/950 (79.7%)
--------------------------------------------------------------------------------

[15:36:13] Progress: 1000/1273 (78.6%)
  Elapsed: 3.8 min | Speed: 260.6 q/min | ETA: 1.0 min
  planning_v5 : 795/1000 (79.5%)
--------------------------------------------------------------------------------

[15:36:13] Progress: 1050/1273 (82.5%)
  Elapsed: 3.8 min | Speed: 273.6 q/min | ETA: 0.8 min
  planning_v5 : 839/1050 (79.9%)
--------------------------------------------------------------------------------

[15:36:13] Progress: 1100/1273 (86.4%)
  Elapsed: 3.8 min | Speed: 286.6 q/min | ETA: 0.6 min
  planning_v5 : 882/1100 (80.2%)
--------------------------------------------------------------------------------

[15:36:13] Progress: 1150/1273 (90.3%)
  Elapsed: 3.8 min | Speed: 299.6 q/min | ETA: 0.4 min
  planning_v5 : 925/1150 (80.4%)
--------------------------------------------------------------------------------

[15:36:13] Progress: 1200/1273 (94.3%)
  Elapsed: 3.8 min | Speed: 312.7 q/min | ETA: 0.2 min
  planning_v5 : 965/1200 (80.4%)
--------------------------------------------------------------------------------

[15:36:13] Progress: 1250/1273 (98.2%)
  Elapsed: 3.8 min | Speed: 325.7 q/min | ETA: 0.1 min
  planning_v5 : 1006/1250 (80.5%)
--------------------------------------------------------------------------------

================================================================================
FINAL RESULTS
================================================================================
Total questions: 1273
Total time: 3.8 minutes (230 seconds)
Speed: 331.7 questions/minute

Accuracy by Mode:
----------------------------------------
  planning_v5 : 1023/1273 (80.4%)
================================================================================

✓ Results saved to: results/medqa_planning_v5_20260123_153613.json
